<?xml version="1.0" encoding="UTF-8"?>                                          
<!DOCTYPE entity SYSTEM "../../dtd/table.dtd">
<entity name="user" table="t_mem_user" description="用户" author="丁海峰" since="1.0">
	<!--
	    主键
	 -->
	<id name="id" column="id" type="long" description="主键"/>

	<property	name="username"   column="username" type="string"  maxlength="50"   description="用户名"  />
	<property	name="password"   column="password" type="string"  maxlength="40"   description="用户密码"  />
	<property	name="status"   column="status" type="int"  maxlength="4"   description="用户状态"  />
	<property	name="telephone"   column="telephone" type="string"  maxlength="13"   description="手机号"  />
	<property	name="mail"   column="mail" type="string"  maxlength="20"   description="邮箱"  />
	<property	name="deptId"   column="dept_id" type="long"  maxlength="4"   description="部门id"  />

	<!--<property	name="remark"   column="remark" type="string"  maxlength="200"   description="备注"  />
	<property	name="isDeleted"   column="is_deleted" type="int"  maxlength="4"   description="是否已删除" />
	<property	name="createBy"   column="create_by" type="string"  maxlength="40"   description="创建人"  />
	<property	name="updateBy"   column="update_by" type="string"  maxlength="40"   description="更新人"  />
	<property	name="createTime"   column="create_time" type="date" description="创建时间"  />
	<property	name="updateTime"   column="update_time" type="date" description="更新时间"  />-->



</entity>