<?xml version="1.0" encoding="UTF-8"?>                                          
<!DOCTYPE entity SYSTEM "../../dtd/table.dtd">
<entity name="jspx" table="jspx" description="教师培训信息表" author="牛鑫" since="1.0">
	<!--                                                                          
		主键                                                                        
	 -->                                                                          
	<id name="id" column="id" type="string" description="主键"/>
<property	name="PXNR"  		 column="PXNR" type="string"  maxlength="50" description="培训内容"   />
<property	name="ZZPXDW"  		 column="ZZPXDW" type="string"  maxlength="20"     description="组织培训单位"   />
<property	name="PXJB"      		 column="PXJB" type="string"  maxlength="10"   description="培训级别"     />
<property	name="PXSJ"  		 column="PXSJ" type="date"  maxlength="0"  description="培训时间" dateFmt="yyyy-MM-dd"    />
<property	name="PXDD"     		 column="PXDD" type="string"  maxlength="20"   description="培训地点"     />
<property	name="PXRY"      		 column="PXRY" type="string"  maxlength="100"   description="参加培训人员"      />
<property	name="PXRS"  		 column="PXRS" type="int"  description="参加培训人数"    />
<property	name="PXJF"      		 column="PXJF" type="string"  maxlength="10"   description="培训经费"      />
<property	name="PXJG"      		 column="PXJG" type="string"  maxlength="50"   description="培训经结果"      />
<property	name="PXXNXQ"  		 column="PXXNXQ" type="string"  maxlength="50"  description="培训学年学期"    />
</entity>        