<?xml version="1.0" encoding="UTF-8"?>                                          
<!DOCTYPE entity SYSTEM "../../dtd/table.dtd">                                     
<!--                                                                            
name:类名称,首字母大写                                                          
package:包名,方面后面的扩展(eg：com.zs.xybb.domian)                             
description：（类的中文名称）页面中用到                                         
author：类的开发作者（注释会用到）                                              
version:类的开发版本                                                            
 -->                                                                            
<entity name="shtj" table="shtj" description="生活条件表" author="孙强强" since="1.0">
	<!--                                                                          
		主键                                                                        
	 -->                                                                          
	<id name="id" column="id" type="string" description="主键"/>                  
	<!--                                                                          
		name:表示属性名称                                                           
		type：属性类型,int | long | string | date |decimal选择其中一个              
		description:描述,生成注释需要，页面内容                                     
	 -->
	<property name="JTBH" column="JTBH" type="string" maxlength="18" description="家庭编号" />
	<property name="ZFZFJG" column="ZF_ZFJG" type="string" maxlength="50" description="住房_住房结构" /> 
	<property name="ZFZFMJ" column="ZF_ZFMJ" type="decimal" maxlength="8" description="住房_住房面积" /> 
	<property name="ZFSFWF" column="ZF_SFWF" type="string" maxlength="5" description="住房_是否危房" /> 
	<property name="ZFCSLB" column="ZF_CSLB" type="string" maxlength="20" description="住房_厕所类别" /> 
	<property name="ZFSFTSFYD" column="ZF_SFTSFYD" type="string" maxlength="2" description="住房_通生活用电" /> 
	<property name="ZFSFTSCYD" column="ZF_SFTSCYD" type="string" maxlength="2" description="住房_通生产用电" /> 
	<property name="YSYSKL" column="YS_YSKL" type="string" maxlength="2" description="饮水_饮水困难" /> 
	<property name="YSYSAQ" column="YS_YSAQ" type="string" maxlength="2" description="饮水_饮水安全" /> 
	<property name="YSYSLY" column="YS_YSLY" type="string" maxlength="30" description="饮水_饮水来源" /> 
	<property name="ZYALLX" column="ZYALLX" type="string" maxlength="20" description="主要燃料类型" /> 
	<property name="RHLLX" column="RHLLX" type="string" maxlength="20" description="入户路类型" /> 
	<property name="YYHLZL" column="YYHLZL" type="decimal" maxlength="8" description="与硬化路距离" /> 
	<property name="SFGMCL" column="SFGMCL" type="string" maxlength="2" description="是否购买车辆" /> 
	<property name="CLLX" column="CLLX" type="string" maxlength="30" description="车辆类型" /> 
	<property name="SFFGTX" column="SFFGTX" type="string" maxlength="2" description="是否覆盖通信" /> 
	<property name="SFFGHLW" column="SFFGHLW" type="string" maxlength="2" description="是否覆盖互联网" /> 
	<property name="SFJRHZS" column="SFJRHZS" type="string" maxlength="2" description="是否加入合作社" /> 
	<property name="SFJRLTQY" column="SFJRLTQY" type="string" maxlength="2" description="是否加入龙头企业" /> 
	<property name="SFJRJTNC" column="SFJRJTNC" type="string" maxlength="2" description="是否加入家庭农场" /> 
	<property name="JTFZQK" column="JTFZQK" type="decimal" maxlength="8" description="家庭负债情况" /> 
	<property name="inputTime" column="input_time" type="date" maxlength="0" description="录入时间" dateFmt="yyyy-MM-dd HH:mm:ss"/> 
	<property name="inputUser" column="input_user" type="string" maxlength="255" description="录入人" /> 

	
	
	
	
	</entity> 