<?xml version="1.0" encoding="UTF-8"?>                                          
<!DOCTYPE entity SYSTEM "../../dtd/table.dtd">
<entity name="kcsj" table="kcsj" description="实践课程信息表" author="牛鑫" since="1.0">
	<!--                                                                          
		主键                                                                        
	 -->                                                                          
	<id name="ID" column="ID" type="string" description="主键"/>
<property	name="KCSJXNXQ"  		 column="KCSJXNXQ" type="string"  maxlength="20" description="课程设计学年学期"   />
<property	name="JSGH"  		 column="JSGH" type="string"  maxlength="20"     description="任课教师工号"   />
<property	name="KCSJMC"      		 column="KCSJMC" type="string"  maxlength="20"   description="课程设计名称"     />
<property	name="KCSJBJ"     		 column="KCSJBJ" type="string"  maxlength="20"   description="课程设计班级"     />
<property	name="ZDJS"      		 column="ZDJS" type="string"  maxlength="20"   description="指导教师"      />
<property	name="XMMC"  		 column="XMMC" type="string"   maxlength="20" description="项目名称"     />
<property	name="ZHXSJXM"  		 column="ZHXSJXM" type="string"  maxlength="2"  description="是否是综合性、设计性项目"    />
<property	name="ZC"  		 column="ZC" type="string"  maxlength="10"   description="周次"     />
<property	name="XQ"  		 column="XQ" type="string"  maxlength="10"     description="星期"   />
<property	name="JC"      		 column="JC" type="string"  maxlength="10"   description="节次"      />
<property	name="SKRS"  		 column="SKRS" type="string"   maxlength="10" description="授课人数"     />
<property	name="ZB"  		 column="ZB" type="string"  maxlength="10"   description="组别"     />
<property	name="SYS"  		 column="SYS" type="string"  maxlength="10"  description="实验室"    />
</entity>        