<?xml version="1.0" encoding="UTF-8"?>                                          
<!DOCTYPE entity SYSTEM "../../dtd/table.dtd">
<entity name="csxx" table="csxx" description="参赛教师统计表" author="牛鑫" since="1.0">
	<!--                                                                          
		主键                                                                        
	 -->                                                                          
	<id name="id" column="id" type="string" description="主键"/>
<property	name="JSGH"  		 column="JSGH" type="string"  maxlength="50" description="教师工号"   />
<property	name="XM"  		 column="XM" type="string"  maxlength="20"     description="姓名"   />
<property	name="CSKC"      		 column="CSKC" type="string"  maxlength="20"   description="参赛课程"     />
<property	name="SKSJ"     		 column="SKSJ" type="string"  maxlength="50"   description="上课时间"     />
<property	name="SKDD"      		 column="SKDD" type="string"  maxlength="20"   description="上课地点"      />
<property	name="PSZZ"  		 column="PSZZ" type="string"   maxlength="20" description="评审组长"     />
<property	name="CSXNXQ"  		 column="CSXNXQ" type="string"  maxlength="50"  description="参赛学年学期"    />
</entity>        