<?xml version="1.0" encoding="UTF-8"?>                                          
<!DOCTYPE entity SYSTEM "../../dtd/table.dtd">
<entity name="sjkc" table="sjkc" description="实践课程信息表" author="牛鑫" since="1.0">
	<!--                                                                          
		主键                                                                        
	 -->                                                                          
	<id name="ID" column="ID" type="string" description="主键"/>
<property	name="SJKCXNXQ"  		 column="SJKCXNXQ" type="string"  maxlength="20" description="实践课程学年学期"   />
<property	name="JSGH"  		 column="JSGH" type="string"  maxlength="20"     description="任课教师工号"   />
<property	name="SJKCDM"      		 column="SJKCDM" type="string"  maxlength="20"   description="实践课程代码"     />
<property	name="SJKCBZMC"     		 column="SJKCBZMC" type="string"  maxlength="20"   description="实践课程标准名称"     />
<property	name="SJKCKSQK"      		 column="SJKCKSQK" type="string"  maxlength="2"   description="实践课程开设情况"      />
<property	name="SKBJ"  		 column="SKBJ" type="string"   maxlength="20" description="授课班级"     />
<property	name="XMTM"  		 column="XMTM" type="string"  maxlength="20"  description="任课教师"    />
<property	name="RKJS"  		 column="RKJS" type="string"  maxlength="10"   description="项目题目"     />
<property	name="WPJSDW"  		 column="WPJSDW" type="string"  maxlength="20"     description="外聘教师单位"   />
<property	name="WPJSDH"      		 column="WPJSDH" type="string"  maxlength="20"   description="外聘教师电话"      />
<property	name="SKZS"  		 column="SKZS" type="string"   maxlength="10" description="授课周数"     />
<property	name="MZKS"  		 column="MZKS" type="string"  maxlength="10"   description="每周课时"     />
<property	name="SYSLX"  		 column="SYSLX" type="string"  maxlength="10"  description="实验室类型"    />
<property	name="ZKS"  		 column="ZKS" type="string"  maxlength="10"     description="总课时"   />
<property	name="SJKBZ"      		 column="SJKBZ" type="string"  maxlength="50"   description="实践课备注"      />
</entity>        