<?xml version="1.0" encoding="UTF-8"?>                                          
<!DOCTYPE entity SYSTEM "../../dtd/table.dtd">                                  
<!--                                                                            
name:类名称,首字母大写                                                          
package:包名,方面后面的扩展(eg：com.zs.xybb.domian)                             
description：（类的中文名称）页面中用到                                         
author：类的开发作者（注释会用到）                                              
version:类的开发版本                                                            
 -->                                                                            
<entity name="sctjGd" table="sctj_gd" description="生产条件_耕地表" author="孙强强" since="1.0">
	<!--                                                                          
		主键                                                                        
	 -->                                                                          
	<id name="id" column="id" type="string" description="主键"/>                  
	<!--                                                                          
		name:表示属性名称                                                           
		type：属性类型,int | long | string | date |decimal选择其中一个              
		description:描述,生成注释需要，页面内容                                     
	 -->
	<property name="JTBH" column="JTBH" type="string" maxlength="18" description="家庭编号" />
	<property name="GDCBGDMJ" column="GD_CBGDMJ" type="string" maxlength="50" description="耕地_承包耕地面积" /> 
	<property name="GDCBZZLB" column="GD_CBZZLB" type="string" maxlength="30" description="耕地_承包种植类别" /> 
	<property name="GDCBMCL" column="GD_CBMCL" type="decimal" maxlength="6" description="耕地_承包亩产量" /> 
	<property name="GDCBMTR" column="GD_CBMTR" type="decimal" maxlength="6" description="耕地_承包亩投入" /> 
	<property name="GDCDMCSY" column="GD_CDMCSY" type="decimal" maxlength="10" description="耕地_承包亩纯收益" /> 
	<property name="GDTGCGDMJ" column="GD_TGCGDMJ" type="decimal" maxlength="6" description="耕地_托管出耕地面积" /> 
	<property name="GDTGCZZLB" column="GD_TGCZZLB" type="string" maxlength="30" description="耕地_托管出种植类别" /> 
	<property name="GDTGZC" column="GD_TGZC" type="decimal" maxlength="6" description="耕地_托管支出" /> 
	<property name="GDTGCMCL" column="GD_TGCMCL" type="decimal" maxlength="6" description="耕地_托管出亩产量" /> 
	<property name="GDTGCMTR" column="GD_TGCMTR" type="decimal" maxlength="6" description="耕地_托管出亩投入" /> 
	<property name="GDTGCMSY" column="GD_TGCMSY" type="decimal" maxlength="6" description="耕地_托管出亩纯收益" /> 
	<property name="GDLZCGDMJ" column="GD_LZCGDMJ" type="decimal" maxlength="6" description="耕地_流转出耕地面积" /> 
	<property name="GDLZCZZLB" column="GD_LZCZZLB" type="string" maxlength="30" description="耕地_流转出种植类别" /> 
	<property name="GZLZSR" column="GZ_LZSR" type="decimal" maxlength="6" description="耕地_流转收入" /> 
	<property name="GDWGSR" column="GD_WGSR" type="decimal" maxlength="6" description="耕地_务工收入" /> 
	<property name="GDLZRGDMJ" column="GD_LZRGDMJ" type="decimal" maxlength="6" description="耕地_流转入耕地面积" /> 
	<property name="GDLZRZZLB" column="GD_LZRZZLB" type="string" maxlength="50" description="耕地_流转入种植类别" /> 
	<property name="GDLZRMCL" column="GD_LZRMCL" type="decimal" maxlength="6" description="耕地_流转入亩产量" /> 
	<property name="GDLZRMTR" column="GD_LZRMTR" type="decimal" maxlength="6" description="耕地_流转入亩投入" /> 
	<property name="GDLZRMCSY" column="GD_LZRMCSY" type="decimal" maxlength="6" description="耕地_流转入亩纯收益" /> 
	<property name="GDTGRGDMJ" column="GD_TGRGDMJ" type="decimal" maxlength="6" description="耕地_托管入耕地面积" /> 
	<property name="GDTGRZZLB" column="GD_TGRZZLB" type="string" maxlength="50" description="耕地_托管入种植类别" /> 
	<property name="GDTGRTGSR" column="GD_TGRTGSR" type="decimal" maxlength="6" description="耕地_托管入托管收入" /> 
	<property name="GDTGRMCL" column="GD_TGRMCL" type="decimal" maxlength="6" description="耕地_托管入亩产量" /> 
	<property name="GDTGRMYR" column="GD_TGRMYR" type="decimal" maxlength="6" description="耕地_托管入亩投入" /> 
	<property name="GDTGRMCSY" column="GD_TGRMCSY" type="decimal" maxlength="6" description="耕地_托管入亩纯收益" /> 
	<property name="inputTime" column="input_time" type="date" maxlength="0" description="录入时间" dateFmt="yyyy-MM-dd HH:mm:ss"/> 
	<property name="inputUser" column="input_user" type="string" maxlength="255" description="录入人" /> 
	
	</entity> 