<?xml version="1.0" encoding="UTF-8"?>                                          
<!DOCTYPE entity SYSTEM "../../dtd/table.dtd">
<entity name="kssjtj" table="kssjtj" description="考试数据统计表" author="牛鑫" since="1.0">
	<!--                                                                          
		主键                                                                        
	 -->                                                                          
	<id name="ID" column="ID" type="string" description="主键"/>
<property	name="NJ"  		 column="NJ" type="string"  maxlength="10"   description="年级"   />
<property	name="ZY"  		 column="ZY" type="string"  maxlength="20"     description="专业"   />
<property	name="KCDM"      		 column="KCDM" type="string"  maxlength="20"   description="课程代码"     />
<property	name="KCMC"     		 column="KCMC" type="string"  maxlength="10"   description="课程名称"     />
<property	name="KCXZ"      		 column="KCXZ" type="string"  maxlength="20"   description="课程性质"      />
<property	name="KSFS"  		 column="KSFS" type="string"  maxlength="10"   description="考试方式"     />
<property	name="CTJS"  		 column="CTJS" type="string"  maxlength="10"   description="出题教师"     />
<property	name="KSZC"  column="KSZC" type="int"     description="考试周次"   />
<property	name="PSCJBFB"  column="PSCJBFB" type="string"  maxlength="10"    description="平时成绩百分比" />
<property	name="ZKCJBFB"  column="ZKCJBFB" type="string"  maxlength="10"   description="中考成绩百分比"    />
<property	name="MKCJBFB"   	 column="MKCJBFB" type="string"  maxlength="10"   description="末考成绩百分比"     />
<property	name="SYCJBFB"  column="SYCJBFB" type="string"  maxlength="10"    description="实验成绩百分比" />
<property	name="BZ"  column="BZ" type="string"  maxlength="50"   description="备注"    />
<property	name="SJYW"   	 column="SJYW" type="string"  maxlength="10"   description="试卷有无"     />
<property	name="SFPK"   	 column="SFPK" type="string"  maxlength="10"   description="是否排考"     />
<property	name="KSTJXNXQ"      		 column="KSTJ_XNXQ" type="string"  maxlength="50"   description="考试统计学年学期"     />
</entity>        