<?xml version="1.0" encoding="UTF-8"?>
<!DOCTYPE entity SYSTEM "../dtd/table.dtd">
<!--
name:类名称,首字母大写
package:包名,方面后面的扩展(eg：com.zs.xybb.domian)
description：（类的中文名称）页面中用到
author：类的开发作者（注释会用到）
version:类的开发版本
 -->
<entity name="Burn" table="p_burn" description="造粒料数据统计" author="赵付录" since="1.0">
	<!-- 
		主键
	 -->
	<id name="id" column="id" type="string" description="主键"/>
	<!-- 
		name:表示属性名称
		type：属性类型,int | long | string | date |decimal选择其中一个
		description:描述,生成注释需要，页面内容
	 -->                              
<property name="voltageGrade" column="voltage_grade" type="int" description="电压等级" />
<property name="chipNo" column="chip_no" type="string" maxlength="50" description="电阻片批号" />
<property name="specifNo" column="specif_no" type="string" maxlength="50" description="规格型号" />
<property name="inkilnNo" column="inkiln_no" type="int" description="待进窑数量/片" />
<property name="inkilnDate" column="inkiln_date" type="date" description="预烧_进窑时间_年/月/日" dateFmt="yyyy-MM-dd HH:mm:ss" />
<property name="inkilnOptor" column="inkiln_optor" type="string" maxlength="30" description="预烧_进窑时间_操作者" />
<property name="inkilnKilnNo" column="inkiln_kiln_no" type="int" description="预烧_进窑时间_窑炉编号" />
<property name="inkilnCupelTime" column="inkiln_cupel_time" type="date" description="预烧_首钵进窑时间" dateFmt="yyyy-MM-dd HH:mm:ss" />
<property name="cycleMin" column="cycle_min" type="int" description="预烧_进车周期/min" />
<property name="hotspaceTemp" column="hotspace_temp" type="decimal" description="预烧_高温区温度/℃" />
<property name="kilnStn" column="kiln_stn" type="int" description="预烧_窑炉有无异常（停电/上下温度不均匀/匣钵更换）" />
<property name="samplingPara" column="sampling_para" type="decimal" description="抽检参数(收缩率/%)" />
<property name="unqualNo" column="unqual_no" type="int" description="抽检参数(抽检合格数)" />
<property name="sliceDate" column="slice_date" type="date" description="抽检参数(出片日期)" dateFmt="yyyy-MM-dd HH:mm:ss" />
<property name="qualifiedNo" column="qualified_no" type="int" description="合格数" />
<property name="qualifiedPara" column="qualified_para" type="decimal" description="合格率" />
<property name="hierarchy" column="hierarchy" type="int" description="分层" />
<property name="incomplete" column="incomplete" type="int" description="缺豁" />
<property name="chromatism" column="chromatism" type="int" description="色差" />
<property name="breakage" column="breakage" type="int" description="断裂" />
<property name="swell" column="swell" type="int" description="鼓包" />
<property name="variant" column="variant" type="int" description="变形" />
<property name="other" column="other" type="int" description="其他" />
<property name="unqualReason" column="unqual_reason" type="string" maxlength="255" description="不合格情况说明" />
<property name="weatherTemp" column="weather_temp" type="decimal" description="预烧_天气情况_温度" />
<property name="weatherStn" column="weather_stn" type="string" maxlength="10" description="预烧_天气情况_天气" />
<property name="weatherWind" column="weather_wind" type="int" description="预烧_天气情况_风级" />
<property name="inputTime" column="input_time" type="date" description="录入时间，系统计入" dateFmt="yyyy-MM-dd HH:mm:ss" />

	
</entity>
