<?xml version="1.0" encoding="UTF-8"?>
<!DOCTYPE entity SYSTEM "../dtd/table.dtd">
<!--
name:类名称,首字母大写
package:包名,方面后面的扩展(eg：com.zs.xybb.domian)
description：（类的中文名称）页面中用到
author：类的开发作者（注释会用到）
version:类的开发版本
 -->
<entity name="WeekReport" table="r_week" description="质量周报" author="任春辉" since="1.0">
	<!-- 
		主键
	 -->
	<id name="id" column="id" type="string" description="主键"/>
	<!-- 
		name:表示属性名称
		type：属性类型,int | long | string | date |decimal选择其中一个
		description:描述,生成注释需要，页面内容
	 -->

<property name="reportName" column="report_name" type="string"  maxlength="80" description="报表名称"         /> 
<property name="startDate" column="start_date" type="date"  description="起始日期" dateFmt="yyyy-MM-dd"/>
<property name="endDate" column="end_date" type="date"  description="截至日期"  dateFmt="yyyy-MM-dd"/>
<property name="submitDepart" column="submit_depart" type="string"  maxlength="50" description="报送部门"         />
<property name="submitOperator" column="submit_operator" type="string"  maxlength="50" description="提交人"         />
<property name="examineOperator" column="examine_operator" type="string"  maxlength="50" description="审核人"         />
<property name="submitCycle" column="submit_cycle" type="string"  maxlength="50" description="提报周期"         />
<property name="overview" column="overview" type="string"  maxlength="255" description="综述"         />
<property name="thisweekDesc" column="thisweek_desc" type="string"  maxlength="255" description="本周情况描述"         />
<property name="qualitySituation" column="quality_situation" type="string"  maxlength="255" description="腿釉试验回收料压制片质量情况"         />
<property name="processFeedback" column="process_feedback" type="string"  maxlength="255" description="过程反馈不合格处理及验证"         />
<property name="headerDate" column="header_date" type="date"  maxlength="0" description="表头日期"  dateFmt="yyyy-MM-dd"       />
<property name="headerWeek" column="header_week" type="int"  maxlength="0" description="表头周"         />
<property name="inputTime" column="input_time" type="date"  description="登记时间"    dateFmt="yyyy-MM-dd"     />
<property name="inputUser" column="input_user" type="string"  maxlength="50" description="操作人"         />
                                                                                                                                                                                                                                      
</entity>
