<?xml version="1.0" encoding="UTF-8"?>                                          
<!DOCTYPE entity SYSTEM "../../dtd/table.dtd">
<entity name="jszlkphz" table="jszlkphz" description="教学质量考评汇总表" author="牛鑫" since="1.0">
	<!--                                                                          
		主键                                                                        
	 -->                                                                          
	<id name="id" column="id" type="string" description="主键"/>
<property	name="JSGH"  		 column="JSGH" type="string"  maxlength="20" description="教师工号"   />
<property	name="JSXM"  		 column="JSXM" type="string"  maxlength="20"     description="教师姓名"   />
<property	name="XSPJDF"      		 column="XSPJDF" type="string"  maxlength="10"   description="学生评教得分"     />
<property	name="THPJDF"     		 column="THPJDF" type="string"  maxlength="10"   description="同行评价得分"     />
<property	name="YSJSGGDF"      column="YSJSGGDF" type="string"  maxlength="50"   description="教学改革与研究得分(原始分)"      />
<property	name="JSGGDF"  		 column="JSGGDF" type="string"   maxlength="10" description="教学改革与研究得分"     />
<property	name="YSTSJSNLDF"  		 column="YSTSJSNLDF" type="string"  maxlength="10"   description="提升教学能力得分(原始分)"     />
<property	name="TSJSNLDF"  		 column="TSJSNLDF" type="string"  maxlength="10"  description="提升教学能力得分"    />
<property	name="ZLPJZF"  		 column="ZLPJZF" type="string"  maxlength="10"     description="质量评价总分"   />
<property	name="ZLPJDJ"      		 column="ZLPJDJ" type="string"  maxlength="50"   description="质量评价等级"      />
<property	name="KPXNXN"  		 column="KPXNXN" type="string"   maxlength="50" description="考评学年学期"     />
</entity>        