<?xml version="1.0" encoding="UTF-8"?>                                          
<!DOCTYPE entity SYSTEM "../../dtd/table.dtd">
<entity name="jsgzlhz" table="jsgzlhz" description="教师工作量汇总表" author="牛鑫" since="1.0">
	<!--                                                                          
		主键                                                                        
	 -->                                                                          
	<id name="ID" column="ID" type="string" description="主键"/>
<property	name="JSGH"  		 column="JSGH" type="string"  maxlength="20"   description="教师工号"   />
<property	name="JSXM"  		 column="JSXM" type="string"  maxlength="20"     description="教师姓名"   />
<property	name="ZGXW"      		 column="ZGXW" type="string"  maxlength="30"   description="最高学位"     />
<property	name="ZC"     		 column="ZC" type="string"  maxlength="10"   description="教室职称"     />
<property	name="ZJXGZL"      		 column="ZJXGZL"  type="decimal" maxlength="10"   description="总教学工作量"      />
<property	name="ZZDGZL"  		 column="ZZDGZL" type="decimal" maxlength="10"   description="总指导工作量"     />
<property	name="ZJ"  		 column="ZJ" type="decimal" maxlength="10"   description="总计"     />
<property	name="GZLHZXNXQ"  		 column="GZLHZ_XNXQ" type="string"  maxlength="50"   description="工作量学年学期"   />
</entity>    