<?xml version="1.0" encoding="UTF-8"?>                                          
<!DOCTYPE entity SYSTEM "../../dtd/table.dtd">
<entity name="pkctpfa" table="pkctpfa" description="县区脱贫路径规划" author="niuxin" since="1.0">
<id name="QHDM" column="QHDM" type="string" description="区划代码"/>   
	<property name="TBND" column="TBND" type="string" maxlength="4" description="填报年度"/> 
	<property name="QHMC" column="QHMC" type="string" maxlength="40" description="贫困村名称" />
	<property name="CZMJ" column="CZMJ" type="decimal" maxlength="12" description="村总面积" /> 
	<property name="ZRCGS" column="ZRCGS" type="int"  description="自然村个数" /> 
	<property name="ZHS" column="ZHS" type="int"  description="总户数" /> 
	<property name="ZRKS" column="ZRKS" type="int"  description="总人数" /> 
	<property name="WBHJZGYHS" column="WBH_JZGYHS" type="int"  description="五保户_集中供养户数" /> 
	<property name="WBHJZGYRKS" column="WBH_JZGYRKS" type="int"  description="五保户_集中供养人口数" /> 
	<property name="WBHFSGYHS" column="WBH_FSGYHS" type="int"  description="五保户_分散供养户数" /> 
	<property name="WBHFSGYRKS" column="WBH_FSGYRKS" type="int"  description="五保户_分散供养人口数" /> 
	<property name="DBHJZGYHS" column="DBH_JZGYHS" type="int"  description="低保户_集中供养户数" /> 
	<property name="DBHJZGYRKS" column="DBH_JZGYRKS" type="int"  description="低保户_集中供人口数" /> 
	<property name="CJTJJSR" column="CJTJJSR" type="decimal" maxlength="12" description="村集体经济收入" /> 
	<property name="PKHZHS" column="PKH_ZHS" type="int"  description="贫困户_总户数" /> 
	<property name="PKHZRKS" column="PKH_ZRKS" type="int"  description="贫困户_总人数" /> 
	<property name="WBPKHHS" column="WBPKH_HS" type="int"  description="五保贫困户_户数" /> 
	<property name="WBPKHRKS" column="WBPKH_RKS" type="int"  description="五保贫困户_人数" /> 
	<property name="DBPKHHS" column="DBPKH_HS" type="int"  description="低保贫困户_户数" /> 
	<property name="DBPKHRKS" column="DBPKH_RKS" type="int"  description="低保贫困户_人数" /> 
	<property name="YBPKHHS" column="YBPKH_HS" type="int"  description="一般贫困户_户数" /> 
	<property name="YBPKHRKS" column="YBPKH_RKS" type="int"  description="一般贫困户_人数" /> 
	<property name="PKFSL" column="PKFSL" type="decimal" maxlength="6" description="贫困发生率" /> 
	<property name="CZDCYLX" column="CZDCYLX" type="string" maxlength="20" description="村主导产业类型" />
	<property name="CZDCYGM" column="CZDCYGM" type="decimal" maxlength="12" description="村主导产业规模" /> 
	<property name="CZDCYSYHS" column="CZDCY_SYHS" type="int"  description="村主导产业_受益户数" /> 
	<property name="CZDCYSYRKS" column="CZDCY_SYRKS" type="int"  description="村主导产业_受益人口数" /> 
	<property name="CZDCYSYPKHS" column="CZDCY_SYPKHS" type="int"  description="村主导产业_受益贫困户数" /> 
	<property name="CZDCYSYPKRKS" column="CZDCY_SYPKRKS" type="int"  description="村主导产业_受益贫困人口数" /> 
	<property name="YBZPHS" column="YBZP_HS" type="int"  description="因病致贫_户数" /> 
	<property name="YBZPRKS" column="YBZP_RKS" type="int"  description="因病致贫_人口数" /> 
	<property name="YCZPHS" column="YCZP_HS" type="int"  description="因残致贫_户数" /> 
	<property name="YCZPRKS" column="YCZP_RKS" type="int"  description="因残致贫_人口数" /> 
	<property name="YXZPHS" column="YXZP_HS" type="int"  description="因学致贫_户数" /> 
	<property name="YXZPRKS" column="YXZP_RKS" type="int"  description="因学致贫_人口数" /> 
	<property name="YZZPHS" column="YZZP_HS" type="int"  description="因灾致贫_户数" /> 
	<property name="YZZPRKS" column="YZZP_RKS" type="int"  description="因灾致贫_人口数" /> 
	<property name="QTDZPHS" column="QTDZP_HS" type="int"  description="缺土地致贫_户数" /> 
	<property name="QTDZPRKS" column="QTDZP_RKS" type="int"  description="缺土地致贫_人口数" /> 
	<property name="QSZPHS" column="QSZP_HS" type="int"  description="缺水致贫_户数" /> 
	<property name="QSZPRKS" column="QSZP_RKS" type="int"  description="缺水致贫_人口数" /> 
	<property name="QJSZPHS" column="QJSZP_HS" type="int"  description="缺技术致贫_户数" /> 
	<property name="QJSZPRKS" column="QJSZP_RKS" type="int"  description="缺技术致贫_人口数" /> 
	<property name="QLDLZPHS" column="QLDLZP_HS" type="int"  description="缺劳动力致贫_户数" /> 
	<property name="QLDLZPRKS" column="QLDLZP_RKS" type="int"  description="缺劳动力致贫_人口数" /> 
	<property name="QZJZPHS" column="QZJZP_HS" type="int"  description="缺资金致贫_户数" /> 
	<property name="QZJZPRKS" column="QZJZP_RKS" type="int"  description="缺资金致贫_人口数" /> 
	<property name="JTTJLHHS" column="JTTJLH_HS" type="int"  description="交通条件落后_户数" /> 
	<property name="JTTJLHRKS" column="JTTJLH_RKS" type="int"  description="交通条件落后_人口数" /> 
	<property name="ZSDLBZHS" column="ZSDLBZ_HS" type="int"  description="自身动力发展不足户数" /> 
	<property name="ZSDLBZRKS" column="ZSDLBZ_RKS" type="int"  description="自身动力发展不足人口数" /> 
	<property name="SFTGL" column="SFTGL" type="string" maxlength="1" description="是否通公路"/> 
	<property name="SFTKYBC" column="SFTKYBC" type="string" maxlength="1" description="是否通客运班车" />
	<property name="SFYSAQ" column="SFYSAQ" type="string" maxlength="1" description="填报是否饮水安全"/> 
	<property name="SFYWHZX" column="SFYWHZX" type="string" maxlength="1" description="是否有文化中心" />
	<property name="SFMZYDXQ" column="SFMZYDXQ" type="string" maxlength="1" description="是否满足用电"/> 
	<property name="SFTGBDS" column="SFTGBDS" type="string" maxlength="1" description="是否通广播电视" />
	<property name="SFYXCYS" column="SFYXCYS" type="string" maxlength="1" description="是否有乡村医生"/> 
	<property name="SFTKD" column="SFTKD" type="string" maxlength="1" description="是否通宽带" />
</entity>