<?xml version="1.0" encoding="UTF-8"?>
<!DOCTYPE entity SYSTEM "../dtd/table.dtd">
<!--
name:类名称,首字母大写
package:包名,方面后面的扩展(eg：com.zs.xybb.domian)
description：（类的中文名称）页面中用到
author：类的开发作者（注释会用到）
version:类的开发版本
 -->
<entity name="Additive" table="p_additive" description="添加剂配料数据统计" author="赵付录" since="1.0">
	<!-- 
		主键
	 -->
	<id name="id" column="id" type="string" description="主键"/>
	<!-- 
		name:表示属性名称
		type：属性类型,int | long | string | date |decimal选择其中一个
		description:描述,生成注释需要，页面内容
	 -->
	<property name="additiveNo"  column="additive_no"  type="string"  maxlength="50" description="添加剂批号"  /> 
	<property name="additiveType"  column="additive_type"  type="string"  maxlength="30" description="添加剂种类"/>
	<property name="formulaNo"  column="formula_no"  type="string"  maxlength="50" description="配方号"   />    
	<property name="weight"  column="weight"  type="decimal" description="重量/kg"   />         
	<property name="optTime"  column="opt_time"  type="date" description="时间" dateFmt="yyyy-MM-dd HH:mm:ss"  />             
	<property name="optor"  column="optor"  type="string"  maxlength="30" description="操作者"   />              
	<property name="bioFactory"  column="bio_factory"  type="string"  maxlength="80" description="厂家"   />    
	<property name="bioNo"  column="bio_no"  type="string"  maxlength="50" description="检验单号"   />          
	<property name="cooFactory"  column="coo_factory"  type="string"  maxlength="80" description="厂家"   />    
	<property name="cooNo"  column="coo_no"  type="string"  maxlength="50" description="检验单号"   />          
	<property name="mnoFactory"  column="mno_factory"  type="string"  maxlength="80" description="厂家"   />    
	<property name="mnoNo"  column="mno_no"  type="string"  maxlength="50" description="检验单号"   />          
	<property name="sboFactory"  column="sbo_factory"  type="string"  maxlength="80" description="厂家"   />    
	<property name="sboNo"  column="sbo_no"  type="string"  maxlength="50" description="检验单号"   />          
	<property name="nio2Factory"  column="nio2_factory"  type="string"  maxlength="80" description="厂家"   />  
	<property name="nio2No"  column="nio2_no"  type="string"  maxlength="50" description="检验单号"   />        
	<property name="nioFactory"  column="nio_factory"  type="string"  maxlength="80" description="厂家"   />    
	<property name="nioNo"  column="nio_no"  type="string"  maxlength="50" description="检验单号"   />          
	<property name="glassFactory"  column="glass_factory"  type="string"  maxlength="80" description="厂家"   />
	<property name="glassNo"  column="glass_no"  type="string"  maxlength="50" description="检验单号"   />      
	<property name="znoFactory"  column="zno_factory"  type="string"  maxlength="80" description="厂家"   />    
	<property name="znoNo"  column="zno_no"  type="string"  maxlength="50" description="检验单号"   />          
	<property name="croFactory"  column="cro_factory"  type="string"  maxlength="80" description="厂家"   />    
	<property name="croNo"  column="cro_no"  type="string"  maxlength="50" description="检验单号"   />          
	<property name="sioFactory"  column="sio_factory"  type="string"  maxlength="80" description="厂家"   />    
	<property name="sioNo"  column="sio_no"  type="string"  maxlength="50" description="检验单号"   />          
	<property name="temperature"  column="temperature"  type="decimal" description="温度/℃"    />
	<property name="humidness"  column="humidness"  type="decimal" description="湿度/%"       />
	<property name="inputTime"  column="input_time"  type="date" description="录入时间" dateFmt="yyyy-MM-dd HH:mm:ss"     />  
	
	
</entity>
