<?xml version="1.0" encoding="UTF-8"?>                                          
<!DOCTYPE entity SYSTEM "../../dtd/table.dtd">
<entity name="kycg" table="kycg" description="科研成果表" author="牛鑫" since="1.0">
	<!--                                                                          
		主键                                                                        
	 -->                                                                          
	<id name="ID" column="ID" type="string" description="主键"/>
<property	name="CID"  		 column="CID" type="int"   description="成果类别编号"   />
<property	name="JSXM"  		 column="JSXM" type="string"  maxlength="10"     description="教师姓名"   />
<property	name="CGMC"      		 column="CGMC" type="string"  maxlength="50"   description="成果名称"     />
<property	name="JDDW"     		 column="JDDW" type="string"  maxlength="20"   description="鉴定单位"     />
<property	name="CGJDXX"      		 column="CGJDXX" type="string"  maxlength="20"   description="成果鉴定信息"      />
<property	name="FZ"  		 column="FZ" type="int"   description="分值"     />
<property	name="KYCGBZ"  		 column="KYCG_BZ" type="string"  maxlength="20"   description="备注"     />
<property	name="KECGRQ"  		 column="KECG_RQ" type="date"  maxlength="0"  description="科研成果鉴定日期" dateFmt="yyyy-MM-dd HH:mm:ss"     />
<property	name="KYCGXNXQ"  		 column="KYCG_XNXQ" type="string"  maxlength="50"     description="科研成果学年学期"   />
</entity>        